{
  "schemaPath": "docs/ops/schemas/release-retry-cleanup-output.schema.json",
  "schemaVersion": "1.0.0",
  "label": "retry:cleanup",
  "summary": {
    "outputDir": "artifacts/release/retry-failures",
    "enabled": true,
    "dryRun": true,
    "ttlDays": 14,
    "maxRuns": 100,
    "maxFiles": 200,
    "cutoffIso": "2026-02-08T00:00:00.000Z",
    "scannedFiles": 10,
    "matchedFiles": 10,
    "matchedRuns": 5,
    "eligibleFiles": 2,
    "eligibleRuns": 1,
    "ttlEligibleFiles": 0,
    "ttlEligibleRuns": 0,
    "maxRunsEligibleFiles": 2,
    "maxRunsEligibleRuns": 1,
    "maxFilesEligibleFiles": 0,
    "maxFilesEligibleRuns": 0,
    "keptFiles": 8,
    "keptRuns": 4,
    "removedFiles": 2,
    "removedRuns": 1,
    "removedBytes": 18517,
    "missingDirectory": false,
    "skippedDisabled": false
  }
}
